{
  "tokens": {
    "color-primary": "oklch(0.58 0.2 252)",
    "color-text": "oklch(0.25 0.02 252)",
    "color-surface": "oklch(0.98 0.005 252)",
    "radius-lg": "0.75rem",
    "space-4": "1rem"
  },
  "themes": {
    "dark": {
      "color-primary": "oklch(0.72 0.19 252)",
      "color-text": "oklch(0.95 0.02 252)",
      "color-surface": "oklch(0.18 0.02 252)"
    }
  },
  "fonts": {
    "font-display": "system-ui, sans-serif",
    "font-text": "system-ui, sans-serif",
    "font-mono": "ui-monospace, monospace"
  },
  "motion": {
    "duration-fast": "150ms",
    "duration-base": "250ms",
    "ease-spring": "cubic-bezier(0.34, 1.56, 0.64, 1)"
  },
  "zIndex": {
    "z-dropdown": "100",
    "z-modal": "500",
    "z-toast": "600"
  },
  "displayP3": {
    "color-primary": "color(display-p3 0.45 0.35 0.95)"
  }
}
